{
  "schema_version": "trex_baseline_v0",
  "meta": {
    "created_at": "2026-02-08T17:19:01Z",
    "deterministic": true,
    "threads": 1,
    "seed": 123,
    "tool_versions": {
      "root": "6.38.00",
      "trexfitter": null,
      "nextstat": "0.1.0"
    },
    "inputs": {
      "export_dir": "/Users/andresvlc/WebDev/nextstat.io/tests/fixtures/trex_exports/hepdata.116034_DR_Int_EWK",
      "combination_xml": "/Users/andresvlc/WebDev/nextstat.io/tests/fixtures/trex_exports/hepdata.116034_DR_Int_EWK/combination.xml",
      "rootdir": "/Users/andresvlc/WebDev/nextstat.io/tests/fixtures/trex_exports/hepdata.116034_DR_Int_EWK",
      "hashes": [
        {
          "path": "/Users/andresvlc/WebDev/nextstat.io/tests/fixtures/trex_exports/hepdata.116034_DR_Int_EWK/combination.xml",
          "rel": "combination.xml",
          "bytes": 499,
          "sha256": "ac4f0c4b3470222074cc345bad7cee727c7db6a48fc7935dd94113c5a1f520ad"
        },
        {
          "path": "/Users/andresvlc/WebDev/nextstat.io/tests/fixtures/trex_exports/hepdata.116034_DR_Int_EWK/data.root",
          "rel": "data.root",
          "bytes": 661834,
          "sha256": "64803a82e71bc95e700d3a8629c22450d75533872d1db92f2b96eba6586ab876"
        }
      ]
    },
    "baseline_env": {
      "timestamp": 1770571136,
      "datetime_utc": "2026-02-08T17:18:56Z",
      "hostname": "MacBook-Pro.local",
      "python": "3.14.2",
      "python_full": "3.14.2 (main, Dec  5 2025, 16:49:16) [Clang 17.0.0 (clang-1700.4.4.1)]",
      "platform": "macOS-26.2-arm64-arm-64bit-Mach-O",
      "machine": "arm64",
      "system": "Darwin",
      "cpu": "Apple M5",
      "git": {
        "commit": "f401728632297407d237a6473c38e41bc2a25984",
        "commit_short": "f4017286",
        "branch": "main",
        "dirty": true
      },
      "root_version": "6.38.00",
      "trexfitter_version": null
    },
    "reference": {
      "mode": "histfactory_export"
    },
    "root_fit": {
      "status": -1,
      "nll_hat": 2668.414512923499,
      "missing_params": [
        "alpha_Zjets_alt",
        "alpha_Zjets_bextrap",
        "alpha_Zjets_ckkw",
        "alpha_Zjets_muF_SUSY",
        "alpha_Zjets_muR_SUSY",
        "alpha_Zjets_muRmuF_SUSY",
        "alpha_Zjets_pdf_q84_q16",
        "alpha_Zjets_qsf",
        "alpha_diboson_ckkw",
        "alpha_diboson_csskin",
        "alpha_diboson_muR_SUSY",
        "alpha_diboson_muRmuF_SUSY",
        "alpha_diboson_qsf",
        "alpha_eg_resolution_all",
        "alpha_eg_scale_all",
        "alpha_el_chargeid_stat",
        "alpha_el_chargeid_systotal",
        "alpha_el_eff_id_total",
        "alpha_el_eff_iso_total",
        "alpha_fake_wgt",
        "alpha_ft_eff_b",
        "alpha_ft_eff_c",
        "alpha_ft_eff_extrap_from_charm",
        "alpha_ft_eff_light",
        "alpha_higgs_xs",
        "alpha_jer_1",
        "alpha_jer_2",
        "alpha_jer_3",
        "alpha_jer_4",
        "alpha_jer_5",
        "alpha_jer_6",
        "alpha_jer_7restterm",
        "alpha_jer_datavsmc_mc16",
        "alpha_jes_detector1",
        "alpha_jes_detector2",
        "alpha_jes_mixed1",
        "alpha_jes_mixed2",
        "alpha_jes_mixed3",
        "alpha_jes_modelling1",
        "alpha_jes_modelling2",
        "alpha_jes_modelling3",
        "alpha_jes_modelling4",
        "alpha_jes_statistical1",
        "alpha_jes_statistical2",
        "alpha_jes_statistical3",
        "alpha_jes_statistical4",
        "alpha_jes_statistical5",
        "alpha_jes_statistical6",
        "alpha_jet_bjes_response",
        "alpha_jet_eta_closure_2018data",
        "alpha_jet_eta_closure_highe",
        "alpha_jet_eta_closure_negeta",
        "alpha_jet_eta_closure_poseta",
        "alpha_jet_eta_modelling",
        "alpha_jet_eta_totalstat",
        "alpha_jet_fjvteff",
        "alpha_jet_flav_composition",
        "alpha_jet_flav_response",
        "alpha_jet_jvteff",
        "alpha_jet_pu_offsetmu",
        "alpha_jet_pu_offsetnpv",
        "alpha_jet_pu_ptterm",
        "alpha_jet_pu_rhotopology",
        "alpha_jet_punch_mc16",
        "alpha_jet_single_highpt",
        "alpha_met_softtrk_resopara",
        "alpha_met_softtrk_resoperp",
        "alpha_met_softtrk_scale",
        "alpha_muon_eff_iso_stat",
        "alpha_muon_eff_iso_sys",
        "alpha_muon_eff_reco_sys",
        "alpha_muon_eff_trigsys",
        "alpha_muon_id",
        "alpha_muon_ms",
        "alpha_muon_sagitta_resbias",
        "alpha_muon_sagitta_rho",
        "alpha_muon_scale",
        "alpha_pileup_wgt",
        "alpha_singleTop_xs",
        "alpha_topOther_hs",
        "alpha_topOther_muF_SUSY",
        "alpha_topOther_muR_SUSY",
        "alpha_topOther_muRmuF_SUSY",
        "alpha_topOther_pdf_q84_q16",
        "alpha_topOther_ps",
        "alpha_topOther_xs",
        "alpha_triboson_xs",
        "alpha_ttbar_fsr",
        "alpha_ttbar_hs",
        "alpha_ttbar_isr",
        "alpha_ttbar_muF_SUSY",
        "alpha_ttbar_muR_SUSY",
        "alpha_ttbar_muRmuF_SUSY",
        "alpha_ttbar_pdf_q84_q16",
        "alpha_ttbar_ps",
        "gamma_stat_CRDY_cuts_bin_0"
      ]
    }
  },
  "fit": {
    "twice_nll": 5336.829025846999,
    "parameters": [
      {
        "name": "Lumi",
        "value": 0.3787397177466917,
        "uncertainty": 0
      },
      {
        "name": "alpha_Zjets_alt",
        "value": 1.338399214324242,
        "uncertainty": 4.031581331606439
      },
      {
        "name": "alpha_Zjets_bextrap",
        "value": 0.1525014564672422,
        "uncertainty": 4.203126512195978
      },
      {
        "name": "alpha_Zjets_ckkw",
        "value": 0.6196461720600743,
        "uncertainty": 4.17442707419845
      },
      {
        "name": "alpha_Zjets_muF_SUSY",
        "value": -1.987322553783059,
        "uncertainty": 3.85837155661731
      },
      {
        "name": "alpha_Zjets_muR_SUSY",
        "value": -1.444671757320479,
        "uncertainty": 4.027307078569692
      },
      {
        "name": "alpha_Zjets_muRmuF_SUSY",
        "value": -1.585490296427841,
        "uncertainty": 3.987173558165872
      },
      {
        "name": "alpha_Zjets_pdf_q84_q16",
        "value": 1.474535496889759,
        "uncertainty": 4.018038873734377
      },
      {
        "name": "alpha_Zjets_qsf",
        "value": -1.21373287182268,
        "uncertainty": 4.079149191185493
      },
      {
        "name": "alpha_diboson_ckkw",
        "value": 1.221205759632557,
        "uncertainty": 4.07457493662867
      },
      {
        "name": "alpha_diboson_csskin",
        "value": 1.547770122409886,
        "uncertainty": 3.989782169495815
      },
      {
        "name": "alpha_diboson_muR_SUSY",
        "value": 0.5050268861269525,
        "uncertainty": 4.185098834068215
      },
      {
        "name": "alpha_diboson_muRmuF_SUSY",
        "value": 0.7887404154674116,
        "uncertainty": 4.154502068770977
      },
      {
        "name": "alpha_diboson_qsf",
        "value": -1.434691438011861,
        "uncertainty": 4.025462727643557
      },
      {
        "name": "alpha_eg_resolution_all",
        "value": -1.713018214211967,
        "uncertainty": 3.951667660453744
      },
      {
        "name": "alpha_eg_scale_all",
        "value": 0.6152954100284402,
        "uncertainty": 4.175183597637037
      },
      {
        "name": "alpha_el_chargeid_stat",
        "value": 0.6077161822660138,
        "uncertainty": 7.227805724121284
      },
      {
        "name": "alpha_el_chargeid_systotal",
        "value": 2.235243417475074,
        "uncertainty": 3.763103357800106
      },
      {
        "name": "alpha_el_eff_id_total",
        "value": -1.190786341815863,
        "uncertainty": 4.084410090897687
      },
      {
        "name": "alpha_el_eff_iso_total",
        "value": -4.853958497839866,
        "uncertainty": 2.23124720169641
      },
      {
        "name": "alpha_fake_wgt",
        "value": 4.408880695201991,
        "uncertainty": 2.024870843717522
      },
      {
        "name": "alpha_ft_eff_b",
        "value": 2.594364242620861,
        "uncertainty": 3.596426023097099
      },
      {
        "name": "alpha_ft_eff_c",
        "value": 1.376746584693247,
        "uncertainty": 4.042127194929119
      },
      {
        "name": "alpha_ft_eff_extrap_from_charm",
        "value": 0.1425982342931364,
        "uncertainty": 4.205641601935231
      },
      {
        "name": "alpha_ft_eff_light",
        "value": -0.8402593586681417,
        "uncertainty": 4.145957952834381
      },
      {
        "name": "alpha_higgs_xs",
        "value": 1.606465105291861,
        "uncertainty": 3.981691606095695
      },
      {
        "name": "alpha_jer_1",
        "value": 2.686356907207841,
        "uncertainty": 3.548490061773461
      },
      {
        "name": "alpha_jer_2",
        "value": 4.475119552997516,
        "uncertainty": 2.057036429112599
      },
      {
        "name": "alpha_jer_3",
        "value": -0.2216966455404706,
        "uncertainty": 4.202116475814426
      },
      {
        "name": "alpha_jer_4",
        "value": 0.2531411516269688,
        "uncertainty": 7.159164207557007
      },
      {
        "name": "alpha_jer_5",
        "value": 3.248025485493808,
        "uncertainty": 3.198493353263447
      },
      {
        "name": "alpha_jer_6",
        "value": -0.9624077787637891,
        "uncertainty": 4.126745079072347
      },
      {
        "name": "alpha_jer_7restterm",
        "value": 0.1879358163785494,
        "uncertainty": 4.203073693240199
      },
      {
        "name": "alpha_jer_datavsmc_mc16",
        "value": 2.66338568178307,
        "uncertainty": 7.392581356478386
      },
      {
        "name": "alpha_jes_detector1",
        "value": 1.581483467925353,
        "uncertainty": 3.99120711257904
      },
      {
        "name": "alpha_jes_detector2",
        "value": -1.489233801975066,
        "uncertainty": 4.015275234885261
      },
      {
        "name": "alpha_jes_mixed1",